{
  "model_id": "example-arch",
  "name": "Example pack (copy this directory)",
  "family": "example",
  "parameter_size": "unknown",
  "context_length": 2048,
  "supported_tasks": ["chat"],
  "memory_required_mb": 512,
  "kv_cache_required_mb": 256,
  "fallback_policy": "cpu.native",
  "chat_template": "{{prompt}}",
  "artifacts": [
    {
      "backend": "cpu.native",
      "path": "model.gguf",
      "format": "gguf",
      "quantization": "Q4_K_M",
      "command": "llama",
      "args": []
    }
  ],
  "expected_throughput": {
    "prefill_tokens_per_second": null,
    "decode_tokens_per_second": null
  }
}
