{
  "model_id": "qwen3.5-4b",
  "name": "Qwen3.5-4B",
  "family": "qwen3.5",
  "parameter_size": "4B",
  "context_length": 8192,
  "supported_tasks": ["chat"],
  "memory_required_mb": 8192,
  "kv_cache_required_mb": 2048,
  "fallback_policy": "cpu.baseline",
  "chat_template": "{{#system}}<|im_start|>system\n{{content}}<|im_end|>\n{{/system}}{{#message}}<|im_start|>{{role}}\n{{content}}<|im_end|>\n{{/message}}<|im_start|>assistant\n",
  "artifacts": [
    {
      "backend": "cpu.baseline",
      "path": "../qwen2.5-0.5b/Qwen3.5-4B-Q8_0.gguf",
      "format": "gguf",
      "quantization": "Q8_0",
      "command": "llama",
      "args": []
    }
  ],
  "expected_throughput": {
    "prefill_tokens_per_second": null,
    "decode_tokens_per_second": null
  }
}
