{
  "model_id": "qwen2.5-0.5b",
  "name": "Qwen2.5-Coder-0.5B-Instruct",
  "family": "qwen2.5-coder",
  "parameter_size": "0.5B",
  "context_length": 32768,
  "supported_tasks": ["chat"],
  "memory_required_mb": 1024,
  "kv_cache_required_mb": 512,
  "fallback_policy": "cpu.baseline",
  "chat_template": "{{#system}}<|im_start|>system\n{{content}}<|im_end|>\n{{/system}}{{#message}}<|im_start|>{{role}}\n{{content}}<|im_end|>\n{{/message}}<|im_start|>assistant\n",
  "artifacts": [
    {
      "backend": "cpu.native",
      "path": "qwen2.5-0.5b-instruct-q4_k_m.gguf",
      "format": "gguf",
      "quantization": "Q4_K_M",
      "command": "llama",
      "args": []
    }
  ],
  "expected_throughput": {
    "prefill_tokens_per_second": null,
    "decode_tokens_per_second": null
  }
}
