{
  "model_id": "smollm2-135m",
  "family": "smollm2",
  "parameter_size": "135M",
  "context_length": 8192,
  "supported_tasks": ["chat"],
  "memory_required_mb": 512,
  "kv_cache_required_mb": 256,
  "fallback_policy": "cpu.native",
  "chat_template": "{{#system}}<|im_start|>system\n{{content}}<|im_end|>\n{{/system}}{{#message}}<|im_start|>{{role}}\n{{content}}<|im_end|>\n{{/message}}<|im_start|>assistant\n",
  "artifacts": [
    {
      "backend": "cpu.native",
      "path": "SmolLM2-135M-Instruct-Q4_K_M.gguf",
      "format": "gguf",
      "quantization": "Q4_K_M",
      "command": "llama",
      "args": []
    }
  ],
  "expected_throughput": {
    "prefill_tokens_per_second": null,
    "decode_tokens_per_second": null
  }
}
